[
  {
    "id": "AA_tip_001",
    "locale": "pt-BR",
    "phonemeId": "AA",
    "title": "Tip 1 for AA",
    "instruction": "Open your mouth wide like you are at the dentist.",
    "commonErrors": [
      "Reducing it to a schwa in stressed positions."
    ],
    "drillTextIds": [
      "basic_003",
      "basic_004",
      "basic_005",
      "basic_006",
      "basic_007"
    ],
    "priority": 1
  },
  {
    "id": "AA_tip_002",
    "locale": "pt-BR",
    "phonemeId": "AA",
    "title": "Tip 2 for AA",
    "instruction": "Keep the tongue flat.",
    "commonErrors": [
      "Reducing it to a schwa in stressed positions."
    ],
    "drillTextIds": [
      "basic_003",
      "basic_004",
      "basic_005",
      "basic_006",
      "basic_007"
    ],
    "priority": 2
  },
  {
    "id": "AH_tip_001",
    "locale": "pt-BR",
    "phonemeId": "AH",
    "title": "Tip 1 for AH",
    "instruction": "Relax your jaw completely.",
    "commonErrors": [
      "Pronouncing it as a full open /a/ at the end of words.",
      "Pronouncing it like 'ay'."
    ],
    "drillTextIds": [
      "basic_002",
      "basic_006",
      "basic_008",
      "adj_002",
      "time_004"
    ],
    "priority": 1
  },
  {
    "id": "AH_tip_002",
    "locale": "pt-BR",
    "phonemeId": "AH",
    "title": "Tip 2 for AH",
    "instruction": "This is the sound of the 'a' at the end of almost every Portuguese word ending in 'a'.",
    "commonErrors": [
      "Pronouncing it as a full open /a/ at the end of words.",
      "Pronouncing it like 'ay'."
    ],
    "drillTextIds": [
      "basic_002",
      "basic_006",
      "basic_008",
      "adj_002",
      "time_004"
    ],
    "priority": 2
  },
  {
    "id": "EY_tip_001",
    "locale": "pt-BR",
    "phonemeId": "EY",
    "title": "Tip 1 for EY",
    "instruction": "Smile slightly and hold the sound steady.",
    "commonErrors": [
      "Adding a 'y' glide at the end (making it a diphthong like in 'day').",
      "Confusing with open /ɛ/."
    ],
    "drillTextIds": [],
    "priority": 1
  },
  {
    "id": "EY_tip_002",
    "locale": "pt-BR",
    "phonemeId": "EY",
    "title": "Tip 2 for EY",
    "instruction": "Do not move your jaw while saying it.",
    "commonErrors": [
      "Adding a 'y' glide at the end (making it a diphthong like in 'day').",
      "Confusing with open /ɛ/."
    ],
    "drillTextIds": [],
    "priority": 2
  },
  {
    "id": "EY_tip_003",
    "locale": "pt-BR",
    "phonemeId": "EY",
    "title": "Tip 3 for EY",
    "instruction": "Think of the French 'é'.",
    "commonErrors": [
      "Adding a 'y' glide at the end (making it a diphthong like in 'day').",
      "Confusing with open /ɛ/."
    ],
    "drillTextIds": [],
    "priority": 2
  },
  {
    "id": "EH_tip_001",
    "locale": "pt-BR",
    "phonemeId": "EH",
    "title": "Tip 1 for EH",
    "instruction": "Drop your jaw more than you think you need to.",
    "commonErrors": [
      "Pronouncing it as /e/ (close-mid).",
      "Diphthongizing it."
    ],
    "drillTextIds": [
      "basic_003",
      "basic_004",
      "basic_008",
      "basic_009",
      "basic_013"
    ],
    "priority": 1
  },
  {
    "id": "EH_tip_002",
    "locale": "pt-BR",
    "phonemeId": "EH",
    "title": "Tip 2 for EH",
    "instruction": "Keep the sound short and flat.",
    "commonErrors": [
      "Pronouncing it as /e/ (close-mid).",
      "Diphthongizing it."
    ],
    "drillTextIds": [
      "basic_003",
      "basic_004",
      "basic_008",
      "basic_009",
      "basic_013"
    ],
    "priority": 2
  },
  {
    "id": "IY_tip_001",
    "locale": "pt-BR",
    "phonemeId": "IY",
    "title": "Tip 1 for IY",
    "instruction": "Stretch your lips into a wide smile.",
    "commonErrors": [
      "Making it too short like 'sit' (should be tenser)."
    ],
    "drillTextIds": [
      "basic_002",
      "basic_004",
      "basic_005",
      "basic_006",
      "basic_008"
    ],
    "priority": 1
  },
  {
    "id": "IY_tip_002",
    "locale": "pt-BR",
    "phonemeId": "IY",
    "title": "Tip 2 for IY",
    "instruction": "It's the 'ee' sound in 'cheese'.",
    "commonErrors": [
      "Making it too short like 'sit' (should be tenser)."
    ],
    "drillTextIds": [
      "basic_002",
      "basic_004",
      "basic_005",
      "basic_006",
      "basic_008"
    ],
    "priority": 2
  },
  {
    "id": "OW_tip_001",
    "locale": "pt-BR",
    "phonemeId": "OW",
    "title": "Tip 1 for OW",
    "instruction": "Round your lips into a small 'o' shape.",
    "commonErrors": [
      "Adding a 'w' glide at the end.",
      "Confusing with open /ɔ/."
    ],
    "drillTextIds": [
      "basic_001",
      "basic_002",
      "basic_003",
      "basic_004",
      "basic_005"
    ],
    "priority": 1
  },
  {
    "id": "OW_tip_002",
    "locale": "pt-BR",
    "phonemeId": "OW",
    "title": "Tip 2 for OW",
    "instruction": "Freeze your jaw; do not let it close as you finish the sound.",
    "commonErrors": [
      "Adding a 'w' glide at the end.",
      "Confusing with open /ɔ/."
    ],
    "drillTextIds": [
      "basic_001",
      "basic_002",
      "basic_003",
      "basic_004",
      "basic_005"
    ],
    "priority": 2
  },
  {
    "id": "AO_tip_001",
    "locale": "pt-BR",
    "phonemeId": "AO",
    "title": "Tip 1 for AO",
    "instruction": "Drop your jaw while keeping lips rounded.",
    "commonErrors": [
      "Pronouncing as close /o/.",
      "Not rounding the lips enough."
    ],
    "drillTextIds": [],
    "priority": 1
  },
  {
    "id": "AO_tip_002",
    "locale": "pt-BR",
    "phonemeId": "AO",
    "title": "Tip 2 for AO",
    "instruction": "Ideally, put a finger between your teeth to ensure openness.",
    "commonErrors": [
      "Pronouncing as close /o/.",
      "Not rounding the lips enough."
    ],
    "drillTextIds": [],
    "priority": 2
  },
  {
    "id": "UW_tip_001",
    "locale": "pt-BR",
    "phonemeId": "UW",
    "title": "Tip 1 for UW",
    "instruction": "Make a 'kissing' face.",
    "commonErrors": [
      "Relaxing lips too much (making it sound like 'book')."
    ],
    "drillTextIds": [
      "basic_009",
      "basic_012",
      "basic_013",
      "verb_007",
      "adj_003"
    ],
    "priority": 1
  },
  {
    "id": "UW_tip_002",
    "locale": "pt-BR",
    "phonemeId": "UW",
    "title": "Tip 2 for UW",
    "instruction": "Push your lips forward.",
    "commonErrors": [
      "Relaxing lips too much (making it sound like 'book')."
    ],
    "drillTextIds": [
      "basic_009",
      "basic_012",
      "basic_013",
      "verb_007",
      "adj_003"
    ],
    "priority": 2
  },
  {
    "id": "AN_NASAL_tip_001",
    "locale": "pt-BR",
    "phonemeId": "AN_NASAL",
    "title": "Tip 1 for AN_NASAL",
    "instruction": "Touch your nose; you should feel vibration.",
    "commonErrors": [
      "Pronouncing the 'n' or 'm' consonant fully (e.g., saying 'ban-da' instead of 'bã-da').",
      "Not engaging the nose."
    ],
    "drillTextIds": [
      "basic_011",
      "time_002",
      "food_word_003",
      "food_word_004",
      "food_word_017"
    ],
    "priority": 1
  },
  {
    "id": "AN_NASAL_tip_002",
    "locale": "pt-BR",
    "phonemeId": "AN_NASAL",
    "title": "Tip 2 for AN_NASAL",
    "instruction": "Do not let your tongue touch the roof of your mouth for the 'n'.",
    "commonErrors": [
      "Pronouncing the 'n' or 'm' consonant fully (e.g., saying 'ban-da' instead of 'bã-da').",
      "Not engaging the nose."
    ],
    "drillTextIds": [
      "basic_011",
      "time_002",
      "food_word_003",
      "food_word_004",
      "food_word_017"
    ],
    "priority": 2
  },
  {
    "id": "EN_NASAL_tip_001",
    "locale": "pt-BR",
    "phonemeId": "EN_NASAL",
    "title": "Tip 1 for EN_NASAL",
    "instruction": "Start to say 'aim' but pinch your nose shut halfway through.",
    "commonErrors": [
      "Pronouncing the 'm' or 'n' clearly.",
      "Too open (sounding like 'eh')."
    ],
    "drillTextIds": [],
    "priority": 1
  },
  {
    "id": "EN_NASAL_tip_002",
    "locale": "pt-BR",
    "phonemeId": "EN_NASAL",
    "title": "Tip 2 for EN_NASAL",
    "instruction": "Keep the tongue flat.",
    "commonErrors": [
      "Pronouncing the 'm' or 'n' clearly.",
      "Too open (sounding like 'eh')."
    ],
    "drillTextIds": [],
    "priority": 2
  },
  {
    "id": "IN_NASAL_tip_001",
    "locale": "pt-BR",
    "phonemeId": "IN_NASAL",
    "title": "Tip 1 for IN_NASAL",
    "instruction": "Smile wide and buzz the sound in your nose.",
    "commonErrors": [
      "Pronouncing the 'm' or 'n' at the end.",
      "Not enough nasality."
    ],
    "drillTextIds": [],
    "priority": 1
  },
  {
    "id": "IN_NASAL_tip_002",
    "locale": "pt-BR",
    "phonemeId": "IN_NASAL",
    "title": "Tip 2 for IN_NASAL",
    "instruction": "It's like a mosquito buzzing 'iii'.",
    "commonErrors": [
      "Pronouncing the 'm' or 'n' at the end.",
      "Not enough nasality."
    ],
    "drillTextIds": [],
    "priority": 2
  },
  {
    "id": "ON_NASAL_tip_001",
    "locale": "pt-BR",
    "phonemeId": "ON_NASAL",
    "title": "Tip 1 for ON_NASAL",
    "instruction": "Round lips tightly.",
    "commonErrors": [
      "Pronouncing 'own' fully.",
      "Not rounding lips enough."
    ],
    "drillTextIds": [],
    "priority": 1
  },
  {
    "id": "ON_NASAL_tip_002",
    "locale": "pt-BR",
    "phonemeId": "ON_NASAL",
    "title": "Tip 2 for ON_NASAL",
    "instruction": "Imagine the sound resonating in your forehead.",
    "commonErrors": [
      "Pronouncing 'own' fully.",
      "Not rounding lips enough."
    ],
    "drillTextIds": [],
    "priority": 2
  },
  {
    "id": "UN_NASAL_tip_001",
    "locale": "pt-BR",
    "phonemeId": "UN_NASAL",
    "title": "Tip 1 for UN_NASAL",
    "instruction": "Make a fish face and grunt through your nose.",
    "commonErrors": [
      "Pronouncing the 'm'.",
      "Not rounding lips."
    ],
    "drillTextIds": [],
    "priority": 1
  },
  {
    "id": "P_tip_001",
    "locale": "pt-BR",